{
  "id": "CASE-0001",
  "synthetic": false,
  "platform": "douyin",
  "scene": "post",
  "submitted_at": "2026-08-22",
  "recorded_at": "2026-10-19",
  "privacy": {
    "public_consent": true,
    "anonymized": true
  },
  "outcome": "rejected",
  "platform_notice": "作品被判「引导至风险不可控渠道」，减少推荐，作品审核状态显示「需优化」。通知标注的触发面是【画面】。通知里给的例句包括「引导用户下载或前往使用其他应用程序、小程序、网站等」和「在作品或个人主页中引导至第三方平台」。",
  "evidence": [
    {
      "channel": "notice",
      "start": 0,
      "end": 0,
      "text": "引导至风险不可控渠道，触发面【画面】"
    },
    {
      "channel": "screen",
      "start": 0,
      "end": 0,
      "text": "图中一行红字：装到 ~/.claude/skills/ 目录下"
    }
  ],
  "hypothesis": "图文里一行第三方软件的安装路径可能被识别为引导下载或前往其他应用。贡献者报告画面里没有网址、二维码或联系方式，但不能据此确认安装路径是唯一触发点，也不能推断所有安装路径都会触发。文案末句「全部开源免费，GitHub 搜 xxx 就能装」也可能构成引导，但这次通知没有标出文案。",
  "confirmed_reason": "按贡献者当天笔记转录的平台通知：引导至风险不可控渠道，触发面为画面。未独立核验原始通知，未确认具体触发内容。",
  "attempts": [],
  "confounders": [
    "这是图文作品不是视频，start 和 end 写 0 只表示无时间轴，具体是第几张图当时没有记录。",
    "作品已发布但被减少推荐，schema 没有限流类结果，按 rejected 记录。实际播放 32，同账号同期同类图文为 500 到 2700。",
    "素材直接沿用为小红书写的版本，只改了尺寸，没有按抖音单独改写。",
    "通知文字按当天的笔记转录，原始截图未随本记录公开，措辞可能与原文有出入。",
    "当时账号主页简介是否带有外部链接没有核实，平台例句提到个人主页，无法排除主页也参与触发。",
    "没有重新发布修改版，所以无法确认去掉这一行后能否恢复推荐。"
  ],
  "rule_ids": [
    "GS-D001"
  ]
}
