{
  "synthetic": false,
  "platform": "xiaohongshu",
  "scene": "post",
  "submitted_at": null,
  "outcome": "pending",
  "platform_notice": "笔记目前正常送审状态，请耐心等待审出。笔记视频42到56秒用户使用了境外软件，会判定这类用户存在实质翻墙行为，后续可能会被管控，建议修改。",
  "hypothesis": "反馈可能结合软件身份、功能入口、操作过程与教学话术，将片段归为使用境外软件。开头也有操作画面，因此不能推断提到工具名称安全、42秒才启动审核或开头被豁免。画面文字、语音、界面识别及人工复核都仅是候选解释；本例未验证平台具体机制、阈值和处罚映射。",
  "confirmed_reason": null,
  "attempts": [],
  "id": "CASE-0002",
  "recorded_at": "2026-10-17",
  "privacy": {
    "public_consent": true,
    "anonymized": true
  },
  "evidence": [
    {
      "channel": "notice",
      "start": 42,
      "end": 56,
      "text": "贡献者提供并称来自平台官方的反馈指向此时间范围；未提交原始工单或通知截图，来源未独立核验。"
    },
    {
      "channel": "screen",
      "start": 0,
      "end": 3.5,
      "text": "开头出现Codex名称、软件界面和手机操作展示；未被反馈单独点名不代表已通过审核。"
    },
    {
      "channel": "screen",
      "start": 42,
      "end": 44,
      "text": "原片抽样复核可见打开插件列表并选择电脑控制功能，界面含模型及软件身份文字。此处为定位范围，非逐帧确认的触发边界。"
    },
    {
      "channel": "subtitle",
      "start": 42,
      "end": 44,
      "text": "字幕介绍打开Codex中的Computer Use插件。"
    },
    {
      "channel": "screen",
      "start": 44,
      "end": 55,
      "text": "原片抽样复核可见手机镜像、任务执行记录、点击指针及放大效果；软件界面保留ChatGPT Work等身份线索。"
    },
    {
      "channel": "subtitle",
      "start": 44,
      "end": 50,
      "text": "字幕解释插件可查看屏幕、模拟点击与滑动，并称正在操作手机。"
    },
    {
      "channel": "notice",
      "start": 0,
      "end": 0,
      "text": "贡献者报告发布时关注者可见、未关注者不可见，称为软限流；未提供同一链接的跨账号核验记录。该现象与反馈中的送审状态分别记录，未确认为永久限制、正式拒审或账号级处罚。"
    }
  ],
  "confounders": [
    "2026-10-17是匿名案例收录日，不是已知的投稿或反馈日期；两项事件日期均未提供。",
    "反馈为贡献者转述的官方文字，未核验原始来源及条款编号；confirmed_reason保留null，不把转述写成已独立证实的处置结论。",
    "反馈称正常送审，最终审核结果未知；outcome=pending。关注关系可见性差异为贡献者观察，其原因、期限及与该片段的因果未确认。",
    "未取得仅保留开头的通过对照、删改后重试或申诉结果，attempts为空。",
    "未检查账号健康、可见范围设置、标题封面、发布入口、商业合作及加热投放设置。",
    "公开广告规则对境外AI工具投放及翻墙相关产品/教程有限制，但不能直接套作普通社区投稿的精确处罚依据；相关规则仅作场景区分索引。",
    "软件运行画面不能证明实际网络连接方式、代理配置或用户已存在所谓实质翻墙行为。",
    "已进行全长独立语音转写与约每秒2帧加切镜的全画面文字扫描，并复核相关代表帧；未完成逐帧视觉检查。",
    "公开记录不含原视频、音轨、截图、私人报告、视频文件名与指纹、账号身份、联系方式、抬头税号、本机路径或私人链接。"
  ],
  "rule_ids": [
    "GS-X002"
  ]
}
